<?xml version="1.0" encoding="UTF-8"?>
<!-- Docbook module, versions 5.0 -->
<xstructure xmlns="http://plugins.intellij.net/xstructure"
            xmlns:xsi="http://www.w3.org/2001/XMLSchema-instance"
            xsi:schemaLocation="http://plugins.intellij.net/xstructure http://plugins.intellij.net/xstructure/ns/xstructure_1_1.xsd"
            implType="default" name="DocBook/Book" version="1.4" priority="10">
    <supported-schemas>
        <schema uri="http://www.docbook.org/xml/5.0/xsd/docbook.xsd"/>
        <schema uri="http://www.docbook.org/xml/5.0/dtd/docbook.dtd"/>
    </supported-schemas>

    <mappings>
        <mapping match=".*/book|.*/article" label="{title} | {subtitle}" icon="/nodes/ppLib.png"/>
        <mapping match=".*/title" skip="all"/>
        <mapping match=".*/subtitle" skip="all"/>
        <mapping match=".*/info" skip="children" icon="/ant/message.png"/>
        <mapping match=".*/toc" skip="children" icon="/nodes/DataTables.png"/>

        <mapping match=".*/chapter" label="{title}" icon="/nodes/folder.png"/>
        <mapping match=".*/appendix" label="{title}" icon="/modules/sourceClosed.png"/>

        <mapping match=".*/sect\d+" label="{title}" icon="/nodes/copyOfFolder.png"/>
        <mapping match=".*/section" label="{title}" icon="/nodes/folder.png"/>
        <mapping match=".*/sectioninfo" label="Author: {author}, Date: {date}"/>

        <mapping match=".*/formalpara" label="{title}"/>
        <mapping match=".*/example" label="{title}"/>
        <mapping match=".*/programlisting" label="Language: {@language}" icon="/debugger/threadSuspended.png"/>

        <mapping match=".*/para" skip="all"/>

        <mapping match=".*/emphasis" skip="all"/>

        <mapping match=".*/table" label="{caption}" skip="children" icon="/nodes/DataTables.png"/>

        <mapping match=".*/qandaentry" label="{question/para}" skip="children" icon="/general/todoQuestion.png"/>
        <mapping match=".*/qandaset" label="Q&amp;A SET" icon="/general/todoQuestion.png"/>

        <!--Inline elements whith short content-->
        <mapping match=".*/code|.*/titleabbrev" label="{.}"/>
    </mappings>
</xstructure>
