<?xml version="1.0" encoding="UTF-8"?>
<!-- Docbook website module, versions 2.5 and 2.6 -->
<xstructure xmlns="http://plugins.intellij.net/xstructure"
            xmlns:xsi="http://www.w3.org/2001/XMLSchema-instance"
            xsi:schemaLocation="http://plugins.intellij.net/xstructure http://plugins.intellij.net/xstructure/ns/xstructure_1_1.xsd"
            implType="default" name="DocBook/Website" version="1.0" priority="10">
  <supported-schemas>
    <schema uri="-//Norman Walsh//DTD Website ( Full)?V2.(5|6).*//EN"/>
    <schema uri="-//OASIS//DTD DocBook XML V4.5//EN"/>
  </supported-schemas>

  <mappings>
    <mapping match="/webpage" label="{@id}"/>
    <mapping match="/webpage/config" skip="all"/>
    <mapping match="/webpage/head" skip="children" label="{title}"/>

    <mapping match=".*/sect\d+" label="{title}"/>
    <mapping match=".*/section" label="{title}"/>
    <mapping match=".*/sectioninfo" label="Author: {author}, Date: {date}"/>

    <mapping match=".*/formalpara" label="{title}"/>
    <mapping match=".*/example" label="{title}"/>
    <mapping match=".*/programlisting" label="Language: {@lang}"/>

    <mapping match=".*/para" label="{.}" tip="{.}" maxlength="45"/>
    <mapping match=".*/title" skip="all"/>

    <!--Inline elements whith short content-->
    <mapping match=".*/code|.*/emphasis|.*/titleabbrev" label="{.}"/>
  </mappings>
</xstructure>
